asin,author,location,date,rating,title,body,verified_purchase,helpful_votes
B08WM3LMJF,Delvys A. Santalla Armiñana,the United States,2025-07-20,5.0,5.0 out of 5 starsExcelente,Son muy cómodos y la calidad del sonido es genial. Lo recomiendo sin dudas. Muy buen equipo.,True,0
B08WM3LMJF,george,the United States,2025-07-20,5.0,5.0 out of 5 starsGood audio at a good price,Very happy with these. Good audio and a good price.,True,0
B08WM3LMJF,Angel,the United States,2025-07-20,5.0,5.0 out of 5 starsJBL Headphones,I use these headphones everyday! They are comfy and connects to Bluetooth easily. I charge them at the beginning of the week and they still have battery remaining at the end of the week,True,0
B08WM3LMJF,laurel hostetler,the United States,2025-07-20,5.0,5.0 out of 5 starsWorked very well.,Was great.,True,0
B08WM3LMJF,Stephanie Rivera,the United States,2025-07-20,1.0,1.0 out of 5 starsBattery life sucks,"I got my a month ago and haven’t been using them much like I thought I would. When I go to try to use them the battery is drained. Again, I hardly use and I charge them when I attempt to use them and notice the battery is drained. If I don’t use them much, shouldn’t it still be charged the next time I try to use them? When I have used them, it’s literally been around 10 minutes. I was going to return them but my return window has closed. Do not recommend.",True,0
B08WM3LMJF,Zamora Bradshaw,the United States,2025-07-20,5.0,5.0 out of 5 starsBest headphones I’ve ever had,"These work so good, they connect very fast and the battery life is so long! These are easy to fold up and put in any bag, super comfortable, and the noise cancelation is chefs kiss. Setup is amazing",True,0
